<?xml version="1.0" ?><flowers xmlns:tns="http://www.example.org/input" xmlns:xsi="http://www.w3.org/2001/XMLSchema-instance" xsi:schemaLocation="http://www.example.org/input input.xsd"><flower><name>Bambusa</name><soil>дерново-подзолистая</soil><origin>China</origin><visualParameters><stemColour>green</stemColour><leafColour>green</leafColour><aveLenFlower measure="cm">1100</aveLenFlower></visualParameters><growingTips><tempreture measure="celcius">30</tempreture><lighting lightRequiring="yes"></lighting><watering measure="mlPerWeek">250</watering></growingTips><multiplying>черенки</multiplying></flower><flower><name>Rose</name><soil>дерново-подзолистая</soil><origin>China</origin><visualParameters><stemColour>green</stemColour><leafColour>green</leafColour><aveLenFlower measure="cm">10</aveLenFlower></visualParameters><growingTips><tempreture measure="celcius">25</tempreture><lighting lightRequiring="yes"></lighting><watering measure="mlPerWeek">110</watering></growingTips><multiplying>черенки</multiplying></flower></flowers>